{
  "schema_version": 1,
  "invocation_id": "plan-reviewer-20260901T063152Z-d53393",
  "role": "plan-reviewer",
  "status": "complete",
  "model_status": "complete",
  "summary": "The plan has multiple blockers and high-severity gaps against both the stated ask and the repository\u2019s current contracts.",
  "error": null,
  "inputs": [
    {
      "path": "/private/tmp/claude-501/-Users-jpalumbo-code-mission-control/87ddfe91-8f92-407e-b2db-f9640eae17d7/scratchpad/selfreview/plan-review-r1.prompt.md",
      "sha256": "0421ab09b83580b32abdea98ac58b7e4bbfd7c367a0319b29d5fd1cfb90e5ef5"
    },
    {
      "path": "/Users/jpalumbo/code/personal/tools/workbench/docs/2026-09-01-clodex-opus-orchestrator-overnight-plan.md",
      "sha256": "a2492b27a95bece801c1c312a7fd5616d4d32b8e96914fdb9046a10f8f850e76"
    }
  ],
  "findings": [
    {
      "id": "F001",
      "severity": "blocker",
      "summary": "Schema upgrades are explicitly routed to the old partial-repair path, not full re-derivation.",
      "detail": "A.1 says schema version 2 should force every profile through re-derivation, but A.2 classifies a contract mismatch as \u201cstop \u2014 existing L488-493 behavior, unchanged.\u201d The current behavior at skills/clodex/SKILL.md:488-492 asks for only the missing/stale keys and rewrites only those keys. Thus requirement 2\u2014the newer-version case\u2014does not reliably converge on full re-derivation.",
      "location": "docs/2026-09-01-clodex-opus-orchestrator-overnight-plan.md:474"
    },
    {
      "id": "F002",
      "severity": "blocker",
      "summary": "The proposed `--bare` Claude commands cannot load the clodex skills they invoke.",
      "detail": "B.3 invokes `claude -p --bare \"/clodex \u2026\"`, while the plan\u2019s own evidence says `--bare` skips skills, commands, subagents, plugins, MCP, memory, CLAUDE.md, and OAuth/keychain credentials. B.10 merely says to pass context explicitly; it never specifies how all five clodex skills, templates, settings, and routing handoffs are supplied. It also selects `dontAsk` without defining the required per-stage allowlist, so write operations and state appends would be denied. The topology cannot execute as written.",
      "location": "docs/2026-09-01-clodex-opus-orchestrator-overnight-plan.md:683"
    },
    {
      "id": "F003",
      "severity": "blocker",
      "summary": "A mandate declaration in a lane brief does not create the standing mandate needed for unattended approval.",
      "detail": "Current clodex requires an actual `approval:granted` event with `scope: \"mandate\"`, bound to the current plan hash and originally granted by the user (skills/clodex-plan/SKILL.md:420-447; docs/clodex-design.md:205-215). B.5 adds only prose to the brief, while gate 7 prohibits any `by: \"user\"` event during unattended runs. Nothing turns the declaration into a valid standing event. Direction approval, finding dispositions, and final plan approval therefore still prompt or stall, so requirement 6 is not met.",
      "location": "docs/2026-09-01-clodex-opus-orchestrator-overnight-plan.md:773"
    },
    {
      "id": "F004",
      "severity": "blocker",
      "summary": "Skipping `clodex-ship` makes the claimed handoff artifact and `handed-off` terminal state impossible.",
      "detail": "B.3 says ship is not run, yet B.8 says a clean lane parks at ship with a handoff and treats `handed-off` as its terminal state. Current clodex creates and records that artifact only in ship after final review and release authorization, then appends `release:updated`, `run:closed`, and archives the run (skills/clodex-ship/SKILL.md:1831-1872, 2033-2061, 2250-2261). Release authorization is explicitly non-delegable. The proposed lane can neither reach the claimed state nor preserve its evidence after worktree removal.",
      "location": "docs/2026-09-01-clodex-opus-orchestrator-overnight-plan.md:691"
    },
    {
      "id": "F005",
      "severity": "high",
      "summary": "The universal tracked-profile probe has no valid first-run ordering.",
      "detail": "A.2 runs `git ls-files --error-unmatch .clodex/profile.json` as part of universal check 7. In a never-bootstrapped repository that necessarily fails. A.6 deletes the existing special ordering at skills/clodex/SKILL.md:178-181 but never states a replacement ordering that runs inspection/interview before this probe. Requirement 1 is therefore not checkably satisfied.",
      "location": "docs/2026-09-01-clodex-opus-orchestrator-overnight-plan.md:480"
    },
    {
      "id": "F006",
      "severity": "high",
      "summary": "The orchestrator bypasses the only current profile validator and bootstrap-currency entry point.",
      "detail": "The only current whole-profile validation is the router call at skills/clodex/SKILL.md:462-475. Stage skills load the profile directly; ship\u2019s schema reads at skills/clodex-ship/SKILL.md:604, 802, and 1273 inspect only the action field set and do not read profile `schema_version`. B.3 invokes `/clodex-build` and `/clodex-verify` directly after the initial plan session, bypassing the proposed router preflight and bootstrap check. A schema or skill update during a run can therefore enter later stages unchecked, and the plan does not account for this consumer topology.",
      "location": "docs/2026-09-01-clodex-opus-orchestrator-overnight-plan.md:683"
    },
    {
      "id": "F007",
      "severity": "high",
      "summary": "Skill-version currency depends on an unowned, unenforced manual `VERSION` bump.",
      "detail": "A.1 says a release process will bump `skills/clodex/VERSION`, but no such file or release process exists in the repo, and no proposed test or gate owns the bump. Installation is by symlink plus `git pull` (README.md:26-27), so a changed SKILL.md with an unchanged VERSION is entirely legal. That defeats the newer-version convergence guarantee for every future non-schema skill change.",
      "location": "docs/2026-09-01-clodex-opus-orchestrator-overnight-plan.md:455"
    },
    {
      "id": "F008",
      "severity": "high",
      "summary": "The bootstrap schema and fingerprint are too incomplete and internally circular to implement reliably.",
      "detail": "The plan gives an example object, not its full JSON Schema: required child fields, types, formats, marker vocabulary, and canonical hash serialization are unspecified. The fixed marker manifest is described only as \u201c~25 paths,\u201d despite claims that it discovers arbitrary second workspace package files. The fingerprint also includes `profile.commands.*`, but first-run inspection occurs before a profile exists and re-derivation may change those commands after the fingerprint is computed. Changes to a package script\u2019s command body with the same key are not detected because only key names are included. A reader cannot determine a correct implementation or test oracle.",
      "location": "docs/2026-09-01-clodex-opus-orchestrator-overnight-plan.md:439"
    },
    {
      "id": "F009",
      "severity": "high",
      "summary": "Worktree behavior is contradictory and has no migration protocol for existing lanes.",
      "detail": "A.2 says repo drift in a linked worktree is merely recorded and that only contract drift stops a lane. A.3 says any worktree needing re-derivation \u201csays so and stops.\u201d Neither section explains how an already-forked lane obtains the new profile commit from the main checkout, how legitimate lane-local marker changes are distinguished, or when it can resume. This fails the requested existing-worktree production analysis.",
      "location": "docs/2026-09-01-clodex-opus-orchestrator-overnight-plan.md:502"
    },
    {
      "id": "F010",
      "severity": "high",
      "summary": "Half-applied schema migration can strand or oscillate profiles between old and new installs.",
      "detail": "There is no atomic profile rewrite, migration journal, minimum-reader version, or recovery rule. If schema v2 lands before the scripts/router text, all profiles fail with no derivation path. If a v2 profile is opened by an older v1 install, the old validator rejects schema_version 2 and current instructions direct it to rewrite only that value back to 1; the custom validator ignores additionalProperties, so the v2 bootstrap block can remain while versions oscillate. Active worktrees retain old profile commits and stop without a defined update path.",
      "location": "docs/2026-09-01-clodex-opus-orchestrator-overnight-plan.md:474"
    },
    {
      "id": "F011",
      "severity": "high",
      "summary": "The topology is not Codex-heavy at most model-bearing stages.",
      "detail": "B.4 lists 11 model-bearing stages: four Codex stages and seven Claude stages\u2014five Opus and two Sonnet\u2014before counting the separate deliverable-lane writer. Repo stages are also driven by Claude sessions. This does not satisfy requirement 4\u2019s request to use Codex for heavy reasoning/execution at most stages.",
      "location": "docs/2026-09-01-clodex-opus-orchestrator-overnight-plan.md:711"
    },
    {
      "id": "F012",
      "severity": "high",
      "summary": "Opus is retained at stages for which the cited research does not establish Opus superiority.",
      "detail": "The table contains five Opus stages, contradicting its own \u201cFour Opus stages\u201d statement. The evidence supports Claude\u2019s relative advantage for computer/MCP use and offers a small third-party code-review comparison, but the brief-authoring anecdote proves only that briefs matter, held-out-test research does not compare models as judges, and no cited comparison supports Opus for morning synthesis. Requirement 5 is therefore only gestured at for three of the five stages.",
      "location": "docs/2026-09-01-clodex-opus-orchestrator-overnight-plan.md:716"
    },
    {
      "id": "F013",
      "severity": "high",